{
  "compartments": 2,
  "absorption": "first_order",
  "route": "oral",
  "error_model": "combined",
  "iiv": [
    "CL",
    "V2",
    "KA"
  ],
  "estimation": "FOCEi",
  "reference_values": {
    "CL": 4.2,
    "V2": 35.0,
    "V3": 120.0,
    "Q": 8.1,
    "KA": 1.1,
    "IIV_CL": 30.0
  },
  "analysis_type": "sensitivity",
  "blq_method": "M3",
  "template": "pk_2cmt_oral_v1"
}
